<?xml version="1.0" encoding="UTF-8"?>
<config  xmlns:xsi="http://www.w3.org/2001/XMLSchema-instance" xsi:noNamespaceSchemaLocation="schema.xsd" >
    <authors>
        <author>
            <name>Иванов Иван Иванович</name>
            <alias>IvanovII</alias>
            <about>
                <p>Образование ОмГУ</p>
                <p>Работа в конторе</p>
            </about>
            <photoUrl>https://images.unsplash.com/photo-1582266255765-fa5cf1a1d501?ixlib=rb-4.0.3&amp;ixid=MnwxMjA3fDB8MHxwaG90by1wYWdlfHx8fGVufDB8fHx8&amp;auto=format&amp;fit=crop&amp;w=2370&amp;q=80</photoUrl>
        </author>
        <author>
            <name>Петров Петр Петрович</name>
            <alias>PetrovPP</alias>
            <url>https://ya.ru/</url>
        </author>
    </authors>
</config>